{
  "schema_version": "1.0-ms3",
  "mode": "conversation",
  "retrieval_mode": "graphrag",
  "run": {
    "run_id": "ms3-20260522T154716-7fc8cba3",
    "started_at": "2026-05-22T15:43:28.201257+00:00",
    "ended_at": "2026-05-22T15:47:16.197802+00:00",
    "framework": "multi_agent_pipeline",
    "parameters": {
      "base_model": "Qwen/Qwen2.5-7B-Instruct"
    }
  },
  "contract": {
    "contract_id": "1",
    "source_type": "txt",
    "hash_sha256": "944f3cc63d215fdeb4182cbeb0d4b6ed3f3a5dcc51fe0680c879e709cabc0502",
    "char_count": 16632,
    "language": "en"
  },
  "playbook": {
    "playbook_id": "contractnli_nda_minimal",
    "version": "1.1",
    "ruleset_hash": "522434a49314eebf038a96bdf24de823eb9f62ab090c1265528bb71cde3af51f",
    "rule_params": {
      "evidence_required_for": [
        "ENTAILED",
        "CONTRADICTED"
      ]
    }
  },
  "intent_router": {
    "name": "intent_router",
    "args": {
      "user_message": "who are the parties in this contract"
    },
    "output": {
      "intent": "conversation",
      "raw_response": "conversation",
      "fallback_used": false
    },
    "count": 1,
    "latency_ms": 2557.65
  },
  "agent_traces": [
    {
      "agent_id": "intent_router",
      "attempts": 1,
      "accepted": true,
      "tool_calls": [
        {
          "name": "intent_router",
          "args": {
            "user_message": "who are the parties in this contract"
          },
          "output": {
            "intent": "conversation",
            "raw_response": "conversation",
            "fallback_used": false
          },
          "count": 1,
          "latency_ms": 2557.65
        }
      ],
      "turn_id": 1
    },
    {
      "agent_id": "conversation_agent",
      "attempts": 1,
      "accepted": true,
      "tool_calls": [
        {
          "name": "retrieve",
          "args": {
            "retrieval_mode": "graphrag",
            "k_requested": 5
          },
          "output": {
            "count": 5,
            "top_score": 0.8213
          },
          "count": 5
        },
        {
          "name": "conversation_agent",
          "args": {
            "retrieval_mode": "graphrag"
          },
          "output": {
            "response_chars": 1219,
            "evidence_count": 0,
            "prompt_tokens": 0,
            "completion_tokens": 0
          },
          "count": 1
        }
      ],
      "turn_id": 1
    }
  ],
  "conversation": {
    "session_id": "660a46aa",
    "created_at": "2026-05-22T15:43:03.510477+00:00",
    "turn_count": 1,
    "turns": [
      {
        "turn_id": 1,
        "user_prompt": "who are the parties in this contract",
        "assistant_response": "The parties in this contract are JEA (the Discloser) and the Recipient.\n\n[EVIDENCE: \"by and between JEA, located at 21 West Church Street, Jacksonville, Florida 32202 (the \"Discloser\"), and ____________________________________________________________ with an address at ______________________________________________ (the \"Recipient\")] \n\nThe contract specifies that the parties are referred to as \"Discloser\" and \"Recipient\" throughout the document. The Recipient's name and address are placeholders that need to be filled in by the actual party entering into the agreement with JEA. \n\n[EVIDENCE: \"WHEREAS, the Recipient desires to work with the discloser and/or view ______________________________________________________________________documents regarding ____________________________________ (the \"Transaction\");\"]\n\nThis evidence further confirms that the Recipient is the entity that desires to work with JEA on a specific transaction. \n\nThere is no mention of additional parties such as agents, representatives, consultants, or financial advisors being included as part of the \"Representatives\" of the parties unless specifically approved by the Discloser. Therefore, the primary parties are JEA and the Recipient.",
        "retrieval_mode": "graphrag",
        "timestamp": "2026-05-22T15:43:34.614869+00:00",
        "precedents": [
          {
            "text": "As used in this Agreement, a party’s “Representatives” shall include the directors, officers, employees, agents, partners or advisors of such party and those of its parent company, subsidiaries and affiliates (including, without limitation, attorneys, accountants, consultants, bankers and financial advisors).",
            "clause_id": "527_span_11",
            "label": "ENTAILED",
            "score": 0.8213,
            "hypothesis_id": "—"
          },
          {
            "text": "(a) For purposes of this Agreement, a Party’s “Representatives” will be deemed to include each Person that is or becomes ",
            "clause_id": "624_span_104",
            "label": "ENTAILED",
            "score": 0.8144,
            "hypothesis_id": "—"
          },
          {
            "text": "(a) For purposes of this Agreement, a Party’s “Representatives” will be deemed to include each Person that is or becomes ",
            "clause_id": "519_span_98",
            "label": "ENTAILED",
            "score": 0.8144,
            "hypothesis_id": "—"
          },
          {
            "text": "(b) that is provided by such Party to the other Party prior to the date of this Agreement.",
            "clause_id": "574_span_55",
            "label": "CONTRADICTED",
            "score": 0.8113,
            "hypothesis_id": "—"
          },
          {
            "text": "WHEREAS, the Parties (which shall include only employees and directors of each Party but shall not include agents, representatives, consultants, or financial advisors, unless disclosure to any such non-employee or non-director has been approved prior to disclosure by the Disclosing Party) are willing to exchange with each other pursuant to this Agreement business and technical information that is ",
            "clause_id": "199_span_6",
            "label": "ENTAILED",
            "score": 0.7873,
            "hypothesis_id": "—"
          }
        ]
      }
    ]
  }
}